{
  "apiVersion": "goodlittlescript.github.io/series/v0",
  "inputs": [
    [
      0
    ],
    [
      1
    ]
  ],
  "kind": "Line",
  "outputs": [
    [
      0,
      1
    ],
    [
      1,
      3
    ],
    [
      2,
      5
    ],
    [
      3,
      7
    ],
    [
      4,
      9
    ],
    [
      5,
      11
    ],
    [
      6,
      13
    ],
    [
      7,
      15
    ],
    [
      8,
      17
    ],
    [
      9,
      19
    ]
  ],
  "spec": {
    "b": 1,
    "m": 2,
    "x": {
      "num": 5,
      "start": 0,
      "step": 1
    }
  }
}
