{
  "apiVersion": "goodlittlescript.github.io/series/v0",
  "kind": "String",
  "metadata": {
    "name": "postgres.password",
    "references": [
      {
        "notes": [
          "postgresql://[user[:password]@][netloc][:port][,...][/dbname][?param1=value1&...]",
          "Percent-encoding may be used to include symbols with special meaning in any of the URI parts, e.g. replace = with %3D."
        ],
        "url": "https://www.postgresql.org/docs/current/libpq-connect.html"
      }
    ]
  },
  "spec": {
    "charset": [
      "print"
    ],
    "max": 30,
    "min": 20,
    "patterns": [
      {
        "name": "typical",
        "regexp": ".{20,30}"
      }
    ]
  }
}
